{
  "profile": "ualf-segments/v1",
  "source": {
    "path": "example-trajectory.jsonl",
    "sha256": "7f4a640390689408230b251ac5ca838b1b731face9f331dab140a482229dede8",
    "bytes": 22062
  },
  "created_at": "2026-08-03T12:00:00Z",
  "segment_policy": {
    "records_per_segment": 5,
    "preserves_exact_bytes": true
  },
  "segments": [
    {
      "index": 0,
      "seq_start": 1,
      "seq_end": 5,
      "offset": 0,
      "bytes": 6141,
      "sha256": "60c9482a294b758a59b2df363e16dbecd850632c8e99ca02ab45a2c385c5036a"
    },
    {
      "index": 1,
      "seq_start": 6,
      "seq_end": 10,
      "offset": 6141,
      "bytes": 5991,
      "sha256": "69ad0f4fedebcb0ab77f312611671322afcb727b36d036c945598db266bd7d46"
    },
    {
      "index": 2,
      "seq_start": 11,
      "seq_end": 15,
      "offset": 12132,
      "bytes": 4984,
      "sha256": "2aae1672b295e44b1f8caf25f83ee16fec85a84b2b8b51a63f99dabee3e39c42"
    },
    {
      "index": 3,
      "seq_start": 16,
      "seq_end": 20,
      "offset": 17116,
      "bytes": 4946,
      "sha256": "f47376c158355a03b95fb0ee6421d89ea60f55d0f93ad77b7d0d6793840f2269"
    }
  ],
  "merkle": {
    "algorithm": "sha256",
    "leaf": "raw-segment-sha256",
    "odd_node": "duplicate_last",
    "root": "08adb48666094160a0be89abc1c9480ef7a988bcc09c9a17ae73123fe2cce239"
  },
  "signing": {
    "key_id": "ualf-segment-demo-1",
    "algorithm": "ed25519",
    "public_key": "pOVuCOJmbkvbWWddhLPs5IgBaJznaJW1UENE1AG+EaU=",
    "registry": "https://example.invalid/keys"
  },
  "seal": {
    "manifest_sha256": "7dd97de20645315ea9832299430df1738e5f290e06d9460ed36c5e96e1ba41df",
    "signature": {
      "key_id": "ualf-segment-demo-1",
      "algorithm": "ed25519",
      "value": "q/k2B0mRoCPlWlVLQkBmcHqwZlMKYa+U0/ihociY+EQCNChes+wEEnlfUDKYKWhmuWxj3fRPledaPX3QGXkZCA=="
    }
  }
}
